number,value,datetime_start,datetime_complete,duration,params_bootstrap,params_criterion,params_max_depth,params_max_features,params_min_samples_leaf,params_n_estimators,state
0,0.6492955600560325,2024-01-28 20:31:55.949272,2024-01-28 20:35:27.699203,0 days 00:03:31.749931,False,gini,24,0.7,35,2100,COMPLETE
1,0.673208839112975,2024-01-28 20:31:55.951272,2024-01-28 20:44:33.012869,0 days 00:12:37.061597,True,gini,9,0.3,5,3850,COMPLETE
2,0.6504347978797939,2024-01-28 20:31:55.953272,2024-01-28 20:43:23.813624,0 days 00:11:27.860352,False,gini,24,0.7,25,800,COMPLETE
3,0.6684381208401152,2024-01-28 20:31:55.956275,2024-01-28 20:40:54.512685,0 days 00:08:58.556410,False,entropy,24,0.1,40,4800,COMPLETE
4,0.6457153597449972,2024-01-28 20:31:55.958274,2024-01-28 20:36:04.188368,0 days 00:04:08.230094,False,entropy,13,0.7,5,400,COMPLETE
5,0.6669630574637682,2024-01-28 20:31:55.961275,2024-01-28 20:36:09.081132,0 days 00:04:13.119857,False,entropy,8,0.1,50,450,COMPLETE
6,0.6698212500526584,2024-01-28 20:31:55.964272,2024-01-28 20:43:12.223688,0 days 00:11:16.259416,True,entropy,22,0.7,20,50,COMPLETE
7,0.6215481561248394,2024-01-28 20:31:55.965271,2024-01-28 20:51:30.627128,0 days 00:19:34.661857,False,entropy,11,0.9,50,4200,COMPLETE
8,0.6497577077417025,2024-01-28 20:31:55.966271,2024-01-28 20:46:08.640655,0 days 00:14:12.674384,False,entropy,19,0.7,10,2100,COMPLETE
9,0.6718125855140317,2024-01-28 20:31:55.969271,2024-01-28 20:38:00.456182,0 days 00:06:04.486911,True,entropy,19,0.5,35,1350,COMPLETE
10,0.6533654350581701,2024-01-28 20:31:55.973272,2024-01-28 20:40:32.644674,0 days 00:08:36.671402,False,gini,5,0.5,40,2850,COMPLETE
11,0.6693090028210662,2024-01-28 20:31:55.976271,2024-01-28 20:44:50.826580,0 days 00:12:54.850309,False,gini,23,sqrt,30,3450,COMPLETE
12,0.6712623653738573,2024-01-28 20:31:55.980273,2024-01-28 20:44:18.536388,0 days 00:12:22.556115,True,gini,13,0.5,30,1450,COMPLETE
13,0.6491645628342286,2024-01-28 20:31:55.982271,2024-01-28 20:44:04.584962,0 days 00:12:08.602691,False,gini,8,0.7,10,4200,COMPLETE
14,0.6674601732548627,2024-01-28 20:31:55.986272,2024-01-28 20:45:56.605549,0 days 00:14:00.619277,False,gini,16,0.3,15,3200,COMPLETE
15,0.6683399874483582,2024-01-28 20:31:55.988272,2024-01-28 20:44:07.386230,0 days 00:12:11.397958,False,gini,17,sqrt,40,1550,COMPLETE
16,0.6683777138017486,2024-01-28 20:35:28.377201,2024-01-28 20:45:51.698837,0 days 00:10:23.321636,False,gini,9,sqrt,40,4350,COMPLETE
17,0.6695987774456629,2024-01-28 20:36:04.854368,2024-01-28 20:46:12.898989,0 days 00:10:08.044621,True,gini,6,0.3,40,2600,COMPLETE
18,0.6147766488381909,2024-01-28 20:36:09.773674,2024-01-28 20:53:19.959043,0 days 00:17:10.185369,False,gini,20,0.9,10,2900,COMPLETE
19,0.6679563802526087,2024-01-28 20:38:00.877756,2024-01-28 20:46:26.951754,0 days 00:08:26.073998,False,gini,9,0.1,20,150,COMPLETE
20,0.6174264338756639,2024-01-28 20:40:33.365706,2024-01-28 21:01:17.682951,0 days 00:20:44.317245,False,entropy,13,0.9,25,4500,COMPLETE
21,0.6435543731692457,2024-01-28 20:40:55.315196,2024-01-28 20:58:08.376326,0 days 00:17:13.061130,False,entropy,5,0.7,45,5000,COMPLETE
22,0.672740449637605,2024-01-28 20:43:12.979285,2024-01-28 20:55:20.426120,0 days 00:12:07.446835,True,entropy,8,0.3,25,2000,COMPLETE
23,0.6217842665761552,2024-01-28 20:43:24.472625,2024-01-28 21:01:23.200551,0 days 00:17:58.727926,False,gini,21,0.9,45,4000,COMPLETE
24,0.6723201355020161,2024-01-28 20:44:05.114477,2024-01-28 20:57:23.695298,0 days 00:13:18.580821,True,gini,18,0.5,15,1150,COMPLETE
25,0.6705996647327134,2024-01-28 20:44:07.970263,2024-01-28 21:01:04.641595,0 days 00:16:56.671332,True,entropy,18,0.5,50,3150,COMPLETE
26,0.6727086244217484,2024-01-28 20:44:19.208387,2024-01-28 21:03:00.810133,0 days 00:18:41.601746,True,entropy,16,0.5,30,3050,COMPLETE
27,0.6745281940210088,2024-01-28 20:44:33.686869,2024-01-28 21:03:56.779222,0 days 00:19:23.092353,True,entropy,18,0.3,15,3450,COMPLETE
28,0.673929668042421,2024-01-28 20:44:51.570097,2024-01-28 21:04:19.836879,0 days 00:19:28.266782,True,entropy,17,0.3,15,3550,COMPLETE
29,0.675031775499845,2024-01-28 20:45:52.252838,2024-01-28 21:05:33.802777,0 days 00:19:41.549939,True,entropy,18,0.3,15,3250,COMPLETE
30,0.6744465189229083,2024-01-28 20:45:57.053550,2024-01-28 21:05:53.542348,0 days 00:19:56.488798,True,entropy,19,0.3,5,2250,COMPLETE
31,0.6704305572080103,2024-01-28 20:46:08.998172,2024-01-28 21:06:08.795994,0 days 00:19:59.797822,True,entropy,11,0.3,50,3600,COMPLETE
32,0.6686810326917717,2024-01-28 20:46:13.338988,2024-01-28 21:06:14.677630,0 days 00:20:01.338642,True,entropy,11,log2,50,3750,COMPLETE
33,0.6741931349081132,2024-01-28 20:46:27.408785,2024-01-28 21:07:01.388192,0 days 00:20:33.979407,True,entropy,20,log2,5,3800,COMPLETE
34,0.6752226921745124,2024-01-28 20:51:31.664641,2024-01-28 21:09:37.286955,0 days 00:18:05.622314,True,entropy,20,0.3,5,3600,COMPLETE
35,0.6733179203572827,2024-01-28 20:53:20.695098,2024-01-28 21:09:38.498015,0 days 00:16:17.802917,True,entropy,15,0.5,25,3650,COMPLETE
36,0.6666975187957055,2024-01-28 20:55:21.298176,2024-01-28 21:07:11.966730,0 days 00:11:50.668554,True,entropy,4,log2,25,1250,COMPLETE
37,0.6741856297005281,2024-01-28 20:57:24.519814,2024-01-28 21:09:36.368917,0 days 00:12:11.849103,True,entropy,11,0.3,5,2200,COMPLETE
38,0.6755280494407879,2024-01-28 20:58:09.468042,2024-01-28 21:10:55.533230,0 days 00:12:46.065188,True,entropy,11,0.3,5,2050,COMPLETE
39,0.6725023086049823,2024-01-28 21:01:04.968597,2024-01-28 21:10:16.946863,0 days 00:09:11.978266,True,gini,15,log2,5,2250,COMPLETE
40,0.6735226772086916,2024-01-28 21:01:18.180066,2024-01-28 21:11:56.088980,0 days 00:10:37.908914,True,gini,15,0.3,5,3800,COMPLETE
41,0.6730751202924996,2024-01-28 21:01:23.941549,2024-01-28 21:11:34.929571,0 days 00:10:10.988022,True,gini,11,0.3,5,2050,COMPLETE
42,0.6761879501185504,2024-01-28 21:03:01.751305,2024-01-28 21:14:07.539122,0 days 00:11:05.787817,True,entropy,15,0.3,5,3650,COMPLETE
43,0.67451033924172,2024-01-28 21:03:57.170222,2024-01-28 21:14:33.301841,0 days 00:10:36.131619,True,entropy,11,0.3,5,3700,COMPLETE
44,0.673274382779136,2024-01-28 21:04:20.286485,2024-01-28 21:13:38.502117,0 days 00:09:18.215632,True,entropy,15,log2,5,3700,COMPLETE
45,0.6726895628259234,2024-01-28 21:05:34.359344,2024-01-28 21:14:27.142916,0 days 00:08:52.783572,True,entropy,15,log2,15,3600,COMPLETE
46,0.672191831360694,2024-01-28 21:05:54.073376,2024-01-28 21:14:43.432949,0 days 00:08:49.359573,True,entropy,15,log2,15,3650,COMPLETE
47,0.6722688954816226,2024-01-28 21:06:09.732994,2024-01-28 21:14:51.731668,0 days 00:08:41.998674,True,entropy,15,log2,15,2450,COMPLETE
48,0.6742778251314451,2024-01-28 21:06:15.470632,2024-01-28 21:16:12.203965,0 days 00:09:56.733333,True,entropy,15,0.3,5,2100,COMPLETE
49,0.6735606833219221,2024-01-28 21:07:02.073249,2024-01-28 21:15:28.972280,0 days 00:08:26.899031,True,entropy,21,log2,5,2250,COMPLETE
50,0.672507910576386,2024-01-28 21:07:12.942732,2024-01-28 21:15:55.857318,0 days 00:08:42.914586,True,entropy,21,log2,5,2350,COMPLETE
51,0.6724792003923621,2024-01-28 21:09:36.658918,2024-01-28 21:16:10.992393,0 days 00:06:34.333475,True,entropy,21,log2,5,2450,COMPLETE
52,0.6748979728135083,2024-01-28 21:09:37.785497,2024-01-28 21:17:46.680462,0 days 00:08:08.894965,True,entropy,15,0.3,10,2550,COMPLETE
53,0.6747656611487628,2024-01-28 21:09:38.868017,2024-01-28 21:18:20.179981,0 days 00:08:41.311964,True,entropy,22,0.3,10,2450,COMPLETE
54,0.6746734855314819,2024-01-28 21:10:17.631468,2024-01-28 21:18:38.662257,0 days 00:08:21.030789,True,entropy,22,0.3,10,2500,COMPLETE
55,0.6739020544818517,2024-01-28 21:10:56.095258,2024-01-28 21:19:48.117057,0 days 00:08:52.021799,True,entropy,23,0.3,20,2600,COMPLETE
56,0.674568738320336,2024-01-28 21:11:35.688571,2024-01-28 21:20:35.942261,0 days 00:09:00.253690,True,entropy,21,0.3,10,2550,COMPLETE
57,0.6754984657838913,2024-01-28 21:11:56.684050,2024-01-28 21:21:14.581598,0 days 00:09:17.897548,True,entropy,22,0.3,10,2600,COMPLETE
58,0.6748203302886459,2024-01-28 21:13:39.105689,2024-01-28 21:22:17.163132,0 days 00:08:38.057443,True,entropy,21,0.3,10,2600,COMPLETE
59,0.6748643063651001,2024-01-28 21:14:08.334767,2024-01-28 21:22:58.179873,0 days 00:08:49.845106,True,entropy,22,0.3,10,2550,COMPLETE
60,0.6751819028584173,2024-01-28 21:14:27.770951,2024-01-28 21:24:17.243469,0 days 00:09:49.472518,True,entropy,22,0.3,10,3300,COMPLETE
61,0.6749922669870132,2024-01-28 21:14:33.561842,2024-01-28 21:24:21.484657,0 days 00:09:47.922815,True,entropy,22,0.3,10,2600,COMPLETE
62,0.6756808194203247,2024-01-28 21:14:44.077951,2024-01-28 21:26:03.200171,0 days 00:11:19.122220,True,entropy,22,0.3,10,3300,COMPLETE
63,0.6746901942916448,2024-01-28 21:14:52.442666,2024-01-28 21:27:00.843931,0 days 00:12:08.401265,True,entropy,22,0.3,10,3350,COMPLETE
64,0.67430723290574,2024-01-28 21:15:29.757793,2024-01-28 21:26:16.382990,0 days 00:10:46.625197,True,entropy,23,0.3,10,1750,COMPLETE
65,0.6747974161666077,2024-01-28 21:15:56.438351,2024-01-28 21:28:13.865871,0 days 00:12:17.427520,True,entropy,24,0.3,10,2700,COMPLETE
66,0.6747063988442062,2024-01-28 21:16:11.292907,2024-01-28 21:29:15.193533,0 days 00:13:03.900626,True,entropy,12,0.3,10,3350,COMPLETE
67,0.6745944984754259,2024-01-28 21:16:12.494968,2024-01-28 21:30:35.277583,0 days 00:14:22.782615,True,entropy,12,0.3,10,4000,COMPLETE
68,0.675250978394183,2024-01-28 21:17:47.463463,2024-01-28 21:30:58.083580,0 days 00:13:10.620117,True,entropy,13,0.3,10,3350,COMPLETE
69,0.6752639679410782,2024-01-28 21:18:20.718981,2024-01-28 21:30:59.330709,0 days 00:12:38.611728,True,entropy,23,0.3,10,1750,COMPLETE
70,0.6746982766771705,2024-01-28 21:18:39.057353,2024-01-28 21:31:37.306208,0 days 00:12:58.248855,True,entropy,13,0.3,10,1700,COMPLETE
71,0.6737450811402802,2024-01-28 21:19:48.898266,2024-01-28 21:31:18.272012,0 days 00:11:29.373746,True,entropy,24,0.1,10,1750,COMPLETE
72,0.6737398279402831,2024-01-28 21:20:36.871344,2024-01-28 21:31:40.314010,0 days 00:11:03.442666,True,entropy,13,0.1,10,1750,COMPLETE
73,0.6739239696051073,2024-01-28 21:21:14.925113,2024-01-28 21:32:09.301004,0 days 00:10:54.375891,True,entropy,13,sqrt,10,2800,COMPLETE
74,0.6736883345545019,2024-01-28 21:22:18.069134,2024-01-28 21:32:15.839717,0 days 00:09:57.770583,True,entropy,13,0.1,10,2850,COMPLETE
75,0.6732734776677225,2024-01-28 21:22:59.172063,2024-01-28 21:32:13.779520,0 days 00:09:14.607457,True,entropy,13,0.1,10,1700,COMPLETE
76,0.6740842271062848,2024-01-28 21:24:17.959471,2024-01-28 21:32:40.386998,0 days 00:08:22.427527,True,entropy,23,0.1,10,1800,COMPLETE
77,0.6743692010015623,2024-01-28 21:24:22.166724,2024-01-28 21:33:18.817434,0 days 00:08:56.650710,True,entropy,24,0.1,10,3350,COMPLETE
78,0.6733810599847587,2024-01-28 21:26:03.732718,2024-01-28 21:33:23.500182,0 days 00:07:19.767464,True,entropy,24,sqrt,10,3300,COMPLETE
79,0.6723731641914809,2024-01-28 21:26:17.010562,2024-01-28 21:33:23.988182,0 days 00:07:06.977620,True,entropy,24,sqrt,20,3250,COMPLETE
80,0.673339334322101,2024-01-28 21:27:01.332931,2024-01-28 21:34:10.105232,0 days 00:07:08.772301,True,entropy,20,0.1,20,2850,COMPLETE
81,0.6719314594561357,2024-01-28 21:28:14.906935,2024-01-28 21:34:11.507292,0 days 00:05:56.600357,True,entropy,20,0.1,20,3000,COMPLETE
82,0.6723122083707637,2024-01-28 21:29:16.269079,2024-01-28 21:34:15.907050,0 days 00:04:59.637971,True,entropy,19,sqrt,20,3000,COMPLETE
83,0.6724108008693828,2024-01-28 21:30:35.479123,2024-01-28 21:34:58.726551,0 days 00:04:23.247428,True,entropy,20,0.1,20,2850,COMPLETE
84,0.6731427873160332,2024-01-28 21:30:58.978611,2024-01-28 21:35:00.786582,0 days 00:04:01.807971,True,entropy,10,0.1,15,2850,COMPLETE
85,0.6726585061853583,2024-01-28 21:30:59.903281,2024-01-28 21:34:56.291352,0 days 00:03:56.388071,True,entropy,10,0.1,20,1800,COMPLETE
86,0.6723129169237891,2024-01-28 21:31:18.399013,2024-01-28 21:35:23.512834,0 days 00:04:05.113821,True,entropy,20,sqrt,20,2850,COMPLETE
87,0.6720079359346763,2024-01-28 21:31:38.328794,2024-01-28 21:35:54.677337,0 days 00:04:16.348543,True,entropy,23,sqrt,20,3000,COMPLETE
88,0.6725075844858581,2024-01-28 21:31:41.173035,2024-01-28 21:35:55.545505,0 days 00:04:14.372470,True,entropy,23,sqrt,20,2950,COMPLETE
89,0.6721241212256942,2024-01-28 21:32:09.907002,2024-01-28 21:39:30.390730,0 days 00:07:20.483728,True,entropy,20,0.7,35,3000,COMPLETE
90,0.6515304935575942,2024-01-28 21:32:13.881562,2024-01-28 21:45:44.666764,0 days 00:13:30.785202,False,entropy,20,0.7,15,3050,COMPLETE
91,0.6509378669170984,2024-01-28 21:32:16.061716,2024-01-28 21:45:08.114603,0 days 00:12:52.052887,False,entropy,10,0.7,15,3050,COMPLETE
92,0.6498984385605091,2024-01-28 21:32:41.116552,2024-01-28 21:48:49.609022,0 days 00:16:08.492470,False,entropy,20,0.7,20,3050,COMPLETE
93,0.6498020814592441,2024-01-28 21:33:19.458464,2024-01-28 21:54:05.947723,0 days 00:20:46.489259,False,entropy,20,0.7,20,3100,COMPLETE
94,0.6495929624836039,2024-01-28 21:33:23.790183,2024-01-28 21:54:22.597005,0 days 00:20:58.806822,False,entropy,20,0.7,20,3000,COMPLETE
95,0.6119020869232201,2024-01-28 21:33:24.332217,2024-01-28 22:04:50.844718,0 days 00:31:26.512501,False,entropy,20,0.9,5,3050,COMPLETE
96,0.6184822212441695,2024-01-28 21:34:10.944263,2024-01-28 22:07:13.345819,0 days 00:33:02.401556,False,entropy,19,0.9,15,3100,COMPLETE
97,0.6506646768002066,2024-01-28 21:34:12.096294,2024-01-28 22:06:31.914332,0 days 00:32:19.818038,False,entropy,10,0.7,15,4050,COMPLETE
98,0.6507965956171035,2024-01-28 21:34:16.215050,2024-01-28 22:10:06.818843,0 days 00:35:50.603793,False,entropy,10,0.7,15,3150,COMPLETE
99,0.6514779056641862,2024-01-28 21:34:56.857910,2024-01-28 22:10:30.400015,0 days 00:35:33.542105,False,entropy,17,0.7,15,3150,COMPLETE
