number,value,datetime_start,datetime_complete,duration,params_activation,params_alpha,params_batch_size,params_layer_size_0,params_layer_size_1,params_layer_size_2,params_layer_size_3,params_layer_size_4,params_layer_size_5,params_layer_size_6,params_layer_size_7,params_layer_size_8,params_layer_size_9,params_learning_rate,params_learning_rate_init,params_num_hiddenlayers,params_solver,state
0,0.5333031133937475,2024-01-28 22:15:12.915723,2024-01-28 22:15:18.681639,0 days 00:00:05.765916,logistic,1.0081246850154546,64,75,145,160.0,,,,,,,,constant,1.734548378299434e-05,3,adam,COMPLETE
1,0.5,2024-01-28 22:15:12.918722,2024-01-28 22:15:25.089214,0 days 00:00:12.170492,relu,55.495041895530065,32,140,75,85.0,10.0,150.0,,,,,,invscaling,0.22154609877697137,5,lbfgs,COMPLETE
2,0.5,2024-01-28 22:15:12.920725,2024-01-28 22:15:43.334958,0 days 00:00:30.414233,relu,91.22201445382728,auto,75,115,140.0,165.0,30.0,120.0,135.0,60.0,25.0,,constant,0.5053250362461625,9,lbfgs,COMPLETE
3,0.6098694531983014,2024-01-28 22:15:12.922722,2024-01-28 22:19:40.824609,0 days 00:04:27.901887,relu,61.886910901472646,auto,70,180,130.0,30.0,,,,,,,constant,0.014410708663329212,4,lbfgs,COMPLETE
4,0.49601663102031396,2024-01-28 22:15:12.926725,2024-01-28 22:15:33.720312,0 days 00:00:20.793587,logistic,58.984467406609156,auto,170,125,195.0,30.0,,,,,,,adaptive,8.894188691875567e-05,4,lbfgs,COMPLETE
5,0.5377064456296979,2024-01-28 22:15:12.928723,2024-01-28 22:17:58.317378,0 days 00:02:45.388655,tanh,49.545968573200696,32,30,90,140.0,65.0,95.0,175.0,35.0,85.0,95.0,40.0,constant,0.0027246956775153013,10,lbfgs,COMPLETE
6,0.48435596363393374,2024-01-28 22:15:12.930723,2024-01-28 22:16:31.265554,0 days 00:01:18.334831,tanh,80.12366232295624,64,195,20,150.0,40.0,45.0,110.0,125.0,20.0,,,adaptive,0.002050310901669439,8,adam,COMPLETE
7,0.48859828017481116,2024-01-28 22:15:12.932722,2024-01-28 22:15:54.807305,0 days 00:00:41.874583,logistic,62.17653169622038,auto,145,10,80.0,80.0,35.0,180.0,200.0,180.0,40.0,105.0,constant,0.00023000314795656375,10,sgd,COMPLETE
8,0.48828400118416726,2024-01-28 22:15:12.935918,2024-01-28 22:15:33.129250,0 days 00:00:20.193332,relu,84.99406804604075,128,125,200,,,,,,,,,invscaling,0.11208072811599724,2,adam,COMPLETE
9,0.6881526210134232,2024-01-28 22:15:12.937724,2024-01-28 22:15:42.415894,0 days 00:00:29.478170,tanh,74.55465849112456,auto,50,25,,,,,,,,,constant,1.7934716413754348e-05,2,lbfgs,COMPLETE
10,0.5634662809248343,2024-01-28 22:15:12.944722,2024-01-28 22:17:08.740966,0 days 00:01:55.796244,relu,2.800739362345317,128,50,190,50.0,165.0,190.0,170.0,155.0,35.0,60.0,40.0,adaptive,0.016495721392210935,10,sgd,COMPLETE
11,0.6877987340106924,2024-01-28 22:15:12.946723,2024-01-28 22:16:46.800237,0 days 00:01:33.853514,tanh,58.25043590753839,auto,170,55,40.0,35.0,55.0,75.0,,,,,adaptive,0.0014293789947376894,6,lbfgs,COMPLETE
12,0.6452720007766946,2024-01-28 22:15:12.949724,2024-01-28 22:18:43.214604,0 days 00:03:30.264880,tanh,43.13466916697737,auto,155,55,,,,,,,,,constant,0.009902737160141296,2,lbfgs,COMPLETE
13,0.6609377058413335,2024-01-28 22:15:12.952158,2024-01-28 22:16:33.054795,0 days 00:01:20.102637,logistic,39.463422608976416,128,50,65,,,,,,,,,constant,0.006602659987128292,2,lbfgs,COMPLETE
14,0.5202786080627246,2024-01-28 22:15:12.954721,2024-01-28 22:16:30.415478,0 days 00:01:17.460757,relu,62.24779499461478,auto,50,120,55.0,185.0,55.0,190.0,140.0,90.0,175.0,,constant,4.682643568847491e-05,9,sgd,COMPLETE
15,0.5,2024-01-28 22:15:12.960723,2024-01-28 22:16:46.057233,0 days 00:01:33.096510,relu,84.65595993467579,128,200,155,90.0,50.0,70.0,15.0,,,,,adaptive,0.0014299861763845023,6,lbfgs,COMPLETE
16,0.5008558718861209,2024-01-28 22:15:19.215780,2024-01-28 22:16:57.896712,0 days 00:01:38.680932,tanh,2.5060440167441356,32,75,75,125.0,25.0,80.0,165.0,150.0,,,,invscaling,0.007030160432866973,7,adam,COMPLETE
17,0.5861340665319908,2024-01-28 22:15:25.856112,2024-01-28 22:23:49.116437,0 days 00:08:23.260325,tanh,1.368967495596296,auto,60,95,140.0,20.0,70.0,80.0,70.0,,,,invscaling,0.10179597436725912,7,lbfgs,COMPLETE
18,0.5,2024-01-28 22:15:33.703247,2024-01-28 22:17:45.062822,0 days 00:02:11.359575,logistic,18.781116099252337,128,75,185,125.0,65.0,180.0,110.0,135.0,10.0,175.0,60.0,adaptive,0.36323345226211134,10,lbfgs,COMPLETE
19,0.4760351946413297,2024-01-28 22:15:34.334050,2024-01-28 22:17:46.247941,0 days 00:02:11.913891,tanh,15.400714368789558,128,115,140,165.0,10.0,120.0,20.0,190.0,190.0,25.0,185.0,invscaling,0.47346287909729007,10,adam,COMPLETE
20,0.5358927455907303,2024-01-28 22:15:43.149962,2024-01-28 22:17:56.890205,0 days 00:02:13.740243,logistic,32.36023747915935,64,60,60,115.0,90.0,200.0,55.0,180.0,,,,invscaling,0.31425932325422407,7,adam,COMPLETE
21,0.49982206405693946,2024-01-28 22:15:44.005527,2024-01-28 22:18:24.710622,0 days 00:02:40.705095,logistic,45.286667444567556,64,130,185,175.0,145.0,140.0,,,,,,constant,0.8269753935270656,5,lbfgs,COMPLETE
22,0.6062798808139792,2024-01-28 22:15:55.407295,2024-01-28 22:19:45.698813,0 days 00:03:50.291518,tanh,71.6953261812471,auto,135,20,195.0,75.0,45.0,145.0,195.0,,,,invscaling,0.957971024563425,7,lbfgs,COMPLETE
23,0.6337335893065277,2024-01-28 22:16:31.054477,2024-01-28 22:18:29.165856,0 days 00:01:58.111379,relu,16.0607170899281,128,30,65,,,,,,,,,invscaling,0.022592800905757916,2,sgd,COMPLETE
24,0.5334799914745206,2024-01-28 22:16:31.925304,2024-01-28 22:19:14.817083,0 days 00:02:42.891779,tanh,87.82009110953528,64,165,125,35.0,140.0,150.0,190.0,90.0,,,,constant,3.291675961901722e-05,7,adam,COMPLETE
25,0.5883028618950338,2024-01-28 22:16:33.745501,2024-01-28 22:24:05.845393,0 days 00:07:32.099892,tanh,30.247081752384922,32,10,50,10.0,130.0,200.0,15.0,,,,,invscaling,0.001163914073089782,6,lbfgs,COMPLETE
26,0.6127412981516243,2024-01-28 22:16:46.715240,2024-01-28 22:20:38.249003,0 days 00:03:51.533763,tanh,30.97278698968018,128,15,60,,,,,,,,,constant,0.0198282679909195,2,lbfgs,COMPLETE
27,0.576160408591028,2024-01-28 22:16:47.302371,2024-01-28 22:25:03.538263,0 days 00:08:16.235892,tanh,36.02916985535914,auto,15,45,15.0,120.0,115.0,40.0,10.0,,,,adaptive,0.016179425122447855,7,lbfgs,COMPLETE
28,0.5734115159201736,2024-01-28 22:16:58.493883,2024-01-28 22:27:30.370852,0 days 00:10:31.876969,tanh,37.45239769153966,auto,25,40,15.0,120.0,140.0,,,,,,adaptive,0.0004526756609723144,5,lbfgs,COMPLETE
29,0.5755844547376745,2024-01-28 22:17:09.505699,2024-01-28 22:28:34.726342,0 days 00:11:25.220643,tanh,35.4052612831309,auto,105,40,10.0,125.0,120.0,,,,,,adaptive,0.00034012217983747086,5,lbfgs,COMPLETE
30,0.6018137080059477,2024-01-28 22:17:45.757828,2024-01-28 22:28:19.537248,0 days 00:10:33.779420,tanh,40.961274412412244,auto,10,40,20.0,115.0,115.0,,,,,,constant,0.00036774209948776623,5,lbfgs,COMPLETE
31,0.5899969294400906,2024-01-28 22:17:46.953939,2024-01-28 22:30:11.395409,0 days 00:12:24.441470,tanh,43.232146286907266,auto,10,40,15.0,110.0,100.0,,,,,,adaptive,0.00036317157132522413,5,lbfgs,COMPLETE
32,0.6881378991219688,2024-01-28 22:17:57.692203,2024-01-28 22:27:54.909804,0 days 00:09:57.217601,tanh,99.85580819651238,auto,10,40,10.0,120.0,,,,,,,constant,0.0003285945084949456,4,lbfgs,COMPLETE
33,0.6881951625628553,2024-01-28 22:17:58.983373,2024-01-28 22:28:05.705345,0 days 00:10:06.721972,tanh,71.94905816583051,auto,20,40,10.0,130.0,,,,,,,adaptive,0.0004071798877489421,4,lbfgs,COMPLETE
34,0.6880610174407297,2024-01-28 22:18:25.311349,2024-01-28 22:28:20.643246,0 days 00:09:55.331897,tanh,73.1856404170066,auto,10,35,15.0,120.0,,,,,,,adaptive,0.0004146853309029783,4,lbfgs,COMPLETE
35,0.6882519463516025,2024-01-28 22:18:29.935299,2024-01-28 22:28:32.460812,0 days 00:10:02.525513,tanh,71.25323915128955,auto,95,35,10.0,115.0,,,,,,,adaptive,0.00045749595963278245,4,lbfgs,COMPLETE
36,0.6875402551665697,2024-01-28 22:18:43.843597,2024-01-28 22:28:24.777470,0 days 00:09:40.933873,tanh,71.3499215995671,auto,10,30,10.0,,,,,,,,constant,0.00046063756555400067,3,lbfgs,COMPLETE
37,0.6870721996083116,2024-01-28 22:19:15.388612,2024-01-28 22:28:29.653226,0 days 00:09:14.264614,tanh,70.48271119682414,auto,10,35,20.0,,,,,,,,adaptive,0.0005197790685277882,3,lbfgs,COMPLETE
38,0.6881658247809217,2024-01-28 22:19:41.320602,2024-01-28 22:28:31.988750,0 days 00:08:50.668148,tanh,73.9707310732923,auto,15,35,10.0,,,,,,,,adaptive,0.0004488484741271954,3,lbfgs,COMPLETE
39,0.6880936093217012,2024-01-28 22:19:46.258972,2024-01-28 22:28:34.173343,0 days 00:08:47.914371,tanh,99.26251295456689,auto,10,45,10.0,,,,,,,,adaptive,0.00021133445893470212,3,lbfgs,COMPLETE
40,0.6882883390772314,2024-01-28 22:20:38.733563,2024-01-28 22:28:44.915739,0 days 00:08:06.182176,tanh,99.32191182549685,auto,105,45,20.0,,,,,,,,adaptive,0.00039090448243329445,3,lbfgs,COMPLETE
41,0.6882564307231996,2024-01-28 22:23:49.785595,2024-01-28 22:28:45.364318,0 days 00:04:55.578723,tanh,99.87369306811362,auto,95,45,15.0,,,,,,,,adaptive,0.0004779556779706534,3,lbfgs,COMPLETE
42,0.5008025854196696,2024-01-28 22:24:06.503393,2024-01-28 22:28:38.175766,0 days 00:04:31.672373,logistic,71.15593515236512,auto,95,40,10.0,,,,,,,,adaptive,0.0004537940737656183,3,lbfgs,COMPLETE
43,0.4430924360064245,2024-01-28 22:25:04.074272,2024-01-28 22:28:44.454741,0 days 00:03:40.380469,logistic,99.83008050187767,auto,95,35,65.0,,,,,,,,adaptive,0.0006608597448125259,3,lbfgs,COMPLETE
44,0.48865351895079767,2024-01-28 22:27:30.926376,2024-01-28 22:28:45.857372,0 days 00:01:14.930996,logistic,99.9569054942069,auto,85,30,65.0,,,,,,,,constant,1.2511947269565493e-05,3,lbfgs,COMPLETE
45,0.476369486037129,2024-01-28 22:27:55.572792,2024-01-28 22:28:46.337893,0 days 00:00:50.765101,tanh,96.59568127548219,auto,90,35,35.0,,,,,,,,constant,1.2602442932949125e-05,3,sgd,COMPLETE
46,0.6882936428197969,2024-01-28 22:28:06.365414,2024-01-28 22:28:49.589663,0 days 00:00:43.224249,tanh,97.52097017378865,auto,35,35,30.0,,,,,,,,adaptive,1.4823872368226802e-05,3,lbfgs,COMPLETE
47,0.6882377334807627,2024-01-28 22:28:20.020246,2024-01-28 22:28:55.173798,0 days 00:00:35.153552,tanh,99.0292390177695,auto,95,30,35.0,,,,,,,,adaptive,1.192171459925791e-05,3,lbfgs,COMPLETE
48,0.6881739137828572,2024-01-28 22:28:21.194246,2024-01-28 22:28:56.641407,0 days 00:00:35.447161,tanh,73.72725071419893,auto,100,20,60.0,,,,,,,,adaptive,1.30041120779592e-05,3,lbfgs,COMPLETE
49,0.6883746426763004,2024-01-28 22:28:25.274468,2024-01-28 22:29:02.591249,0 days 00:00:37.316781,tanh,98.93404193024746,auto,100,30,65.0,,,,,,,,adaptive,1.2620058884004748e-05,3,lbfgs,COMPLETE
50,0.6883407989848331,2024-01-28 22:28:30.120222,2024-01-28 22:29:08.175530,0 days 00:00:38.055308,tanh,77.89748206217384,auto,35,25,65.0,100.0,,,,,,,adaptive,1.619543561172461e-05,4,lbfgs,COMPLETE
51,0.6884004060150181,2024-01-28 22:28:32.443812,2024-01-28 22:29:07.471998,0 days 00:00:35.028186,tanh,77.99715169040033,auto,105,20,70.0,,,,,,,,adaptive,1.5704106048773073e-05,3,lbfgs,COMPLETE
52,0.6884606667805022,2024-01-28 22:28:32.986813,2024-01-28 22:29:09.896215,0 days 00:00:36.909402,tanh,78.72232037112205,auto,90,20,70.0,,,,,,,,adaptive,1.1247461352597494e-05,3,lbfgs,COMPLETE
53,0.4861382638233806,2024-01-28 22:28:34.697339,2024-01-28 22:29:11.865866,0 days 00:00:37.168527,tanh,78.97068225279712,32,85,10,65.0,,,,,,,,adaptive,1.867021857362211e-05,3,sgd,COMPLETE
54,0.5227983617872175,2024-01-28 22:28:35.332934,2024-01-28 22:29:14.326395,0 days 00:00:38.993461,tanh,77.31555646350856,32,90,10,65.0,,,,,,,,adaptive,1.3496755135051952e-05,3,sgd,COMPLETE
55,0.48405477414819914,2024-01-28 22:28:38.746766,2024-01-28 22:29:16.144461,0 days 00:00:37.397695,tanh,78.26983800218801,32,90,10,65.0,100.0,,,,,,,adaptive,1.1284933287892919e-05,4,sgd,COMPLETE
56,0.5100051942929895,2024-01-28 22:28:44.862732,2024-01-28 22:29:18.085473,0 days 00:00:33.222741,tanh,92.86998803239577,32,35,10,30.0,100.0,,,,,,,adaptive,0.0001231937727762039,4,sgd,COMPLETE
57,0.6881648035797931,2024-01-28 22:28:45.316314,2024-01-28 22:29:25.643870,0 days 00:00:40.327556,tanh,92.71764753613857,32,85,15,30.0,100.0,,,,,,,adaptive,0.00015674024117545135,4,lbfgs,COMPLETE
58,0.6883194783932577,2024-01-28 22:28:45.845373,2024-01-28 22:29:30.716011,0 days 00:00:44.870638,tanh,91.51924788441784,32,115,15,25.0,100.0,,,,,,,adaptive,0.00012849857869279667,4,lbfgs,COMPLETE
59,0.6881959538704384,2024-01-28 22:28:46.284369,2024-01-28 22:29:35.130451,0 days 00:00:48.846082,tanh,92.53662597411373,32,115,10,30.0,100.0,,,,,,,adaptive,0.00011860508638523006,4,lbfgs,COMPLETE
60,0.6881862945251356,2024-01-28 22:28:46.782424,2024-01-28 22:29:39.822770,0 days 00:00:53.040346,tanh,92.85384850440605,32,110,75,30.0,100.0,,,,,,,adaptive,0.0001431516355198226,4,lbfgs,COMPLETE
61,0.5397179697505812,2024-01-28 22:28:50.130662,2024-01-28 22:29:39.069611,0 days 00:00:48.938949,tanh,91.63723369176697,32,120,10,25.0,95.0,,,,,,,adaptive,0.00012032080935529525,4,sgd,COMPLETE
62,0.5427040785013254,2024-01-28 22:28:55.685404,2024-01-28 22:29:42.180351,0 days 00:00:46.494947,tanh,92.25749551995615,32,115,20,30.0,95.0,,,,,,,adaptive,0.00012275022315809872,4,sgd,COMPLETE
63,0.5267061339544801,2024-01-28 22:28:57.297404,2024-01-28 22:29:45.465963,0 days 00:00:48.168559,tanh,91.19026887664569,32,115,10,30.0,100.0,,,,,,,adaptive,0.00011164403021653071,4,sgd,COMPLETE
64,0.548003595925785,2024-01-28 22:29:03.037858,2024-01-28 22:29:54.011746,0 days 00:00:50.973888,tanh,90.9851067716582,32,120,10,45.0,200.0,,,,,,,adaptive,0.00015234247501893968,4,sgd,COMPLETE
65,0.5356765613750274,2024-01-28 22:29:07.781003,2024-01-28 22:29:46.396172,0 days 00:00:38.615169,relu,92.5622307776936,32,115,10,,,,,,,,,adaptive,0.00010511687692313037,2,sgd,COMPLETE
66,0.4942862171870962,2024-01-28 22:29:08.462532,2024-01-28 22:30:00.038495,0 days 00:00:51.575963,tanh,92.74326746475585,32,115,10,75.0,200.0,,,,,,,adaptive,7.635332876912917e-05,4,sgd,COMPLETE
67,0.512963372496626,2024-01-28 22:29:10.178211,2024-01-28 22:30:03.433720,0 days 00:00:53.255509,tanh,92.86140863852047,32,115,10,80.0,200.0,,,,,,,adaptive,2.9218871924109188e-05,4,sgd,COMPLETE
68,0.4914715568729422,2024-01-28 22:29:12.108869,2024-01-28 22:29:57.065363,0 days 00:00:44.956494,relu,92.22225206938967,32,120,15,80.0,200.0,,,,,,,adaptive,0.00010388402884452496,4,lbfgs,COMPLETE
69,0.44693691058882,2024-01-28 22:29:14.680393,2024-01-28 22:30:02.090043,0 days 00:00:47.409650,relu,92.75726086271595,64,115,15,85.0,95.0,,,,,,,adaptive,8.47316564971835e-05,4,lbfgs,COMPLETE
70,0.6853028518339779,2024-01-28 22:29:16.634465,2024-01-28 22:31:06.712635,0 days 00:01:50.078170,relu,94.53436045369695,64,120,20,,,,,,,,,adaptive,0.00010169023895335035,2,lbfgs,COMPLETE
71,0.6850223494255017,2024-01-28 22:29:18.681572,2024-01-28 22:31:51.239360,0 days 00:02:32.557788,relu,92.02989347388402,64,115,75,,,,,,,,,adaptive,5.064326225427206e-05,2,lbfgs,COMPLETE
72,0.525875010893545,2024-01-28 22:29:26.238868,2024-01-28 22:30:08.394234,0 days 00:00:42.155366,relu,83.68966338521497,64,120,20,,,,,,,,,adaptive,5.59529262356733e-05,2,adam,COMPLETE
73,0.5220665967075259,2024-01-28 22:29:31.172013,2024-01-28 22:30:10.210867,0 days 00:00:39.038854,relu,83.21120357121842,64,125,20,,,,,,,,,adaptive,4.5615681259365506e-05,2,adam,COMPLETE
74,0.5352561048383222,2024-01-28 22:29:35.462449,2024-01-28 22:30:14.555463,0 days 00:00:39.093014,relu,83.08200838347007,64,120,20,,,,,,,,,adaptive,5.838011650123785e-05,2,adam,COMPLETE
75,0.5507479800255137,2024-01-28 22:29:39.391761,2024-01-28 22:30:15.423465,0 days 00:00:36.031704,relu,84.77773809999452,64,65,20,,,,,,,,,adaptive,5.007528515251044e-05,2,adam,COMPLETE
76,0.5219648994160965,2024-01-28 22:29:40.115770,2024-01-28 22:30:16.490089,0 days 00:00:36.374319,relu,84.58563957819278,64,40,25,,,,,,,,,adaptive,5.4802227482685603e-05,2,adam,COMPLETE
77,0.5496709690098756,2024-01-28 22:29:42.404351,2024-01-28 22:30:19.141138,0 days 00:00:36.736787,relu,84.55686552069535,64,65,25,,,,,,,,,adaptive,5.5314290289681384e-05,2,adam,COMPLETE
78,0.548387837312125,2024-01-28 22:29:45.926953,2024-01-28 22:30:19.678675,0 days 00:00:33.751722,relu,82.53216750500289,64,65,25,,,,,,,,,adaptive,5.264188545379882e-05,2,adam,COMPLETE
79,0.5078328878112697,2024-01-28 22:29:46.835175,2024-01-28 22:30:22.410779,0 days 00:00:35.575604,relu,83.81074083928516,64,40,25,80.0,200.0,10.0,,,,,,adaptive,5.493191137026603e-05,5,adam,COMPLETE
80,0.554622667359614,2024-01-28 22:29:54.567735,2024-01-28 22:30:25.664422,0 days 00:00:31.096687,relu,84.42398985512477,64,145,25,,,,,,,,,adaptive,5.588059645997083e-05,2,adam,COMPLETE
81,0.552900503441949,2024-01-28 22:29:57.592363,2024-01-28 22:30:27.428100,0 days 00:00:29.835737,tanh,82.77087583460234,64,40,25,,,,,,,,,adaptive,5.3740235382232244e-05,2,adam,COMPLETE
82,0.5298861488937245,2024-01-28 22:30:00.649491,2024-01-28 22:30:33.584612,0 days 00:00:32.935121,relu,83.06734040282586,auto,145,25,,,,,,,,,adaptive,2.5508042570206736e-05,2,adam,COMPLETE
83,0.5274381804748094,2024-01-28 22:30:02.675041,2024-01-28 22:30:31.145823,0 days 00:00:28.470782,tanh,66.17674349047643,auto,40,25,,,,,,,,,adaptive,2.4161898736635793e-05,2,adam,COMPLETE
84,0.5670865059156716,2024-01-28 22:30:03.950784,2024-01-28 22:30:37.524302,0 days 00:00:33.573518,tanh,84.9040705038043,auto,70,25,,,,,,,,,adaptive,4.845046006662429e-05,2,adam,COMPLETE
85,0.687828279772527,2024-01-28 22:30:08.890240,2024-01-28 22:30:49.580797,0 days 00:00:40.690557,tanh,66.73927543781532,auto,145,25,,,,,,,,,invscaling,2.5709699679139778e-05,2,lbfgs,COMPLETE
86,0.6868469346470035,2024-01-28 22:30:10.771400,2024-01-28 22:30:53.253516,0 days 00:00:42.482116,tanh,65.86191746707149,auto,40,55,,,,,,,,,adaptive,2.446103979722333e-05,2,lbfgs,COMPLETE
87,0.687787154676601,2024-01-28 22:30:11.864401,2024-01-28 22:31:07.487637,0 days 00:00:55.623236,tanh,66.46944546538407,auto,145,50,,,,,,,,,adaptive,2.3692293398449883e-05,2,lbfgs,COMPLETE
88,0.6876524786320811,2024-01-28 22:30:15.018459,2024-01-28 22:31:07.964634,0 days 00:00:52.946175,tanh,67.04596236307718,auto,60,55,,,,,,,,,adaptive,2.586434295552639e-05,2,lbfgs,COMPLETE
89,0.6885008292501027,2024-01-28 22:30:15.898475,2024-01-28 22:31:15.737359,0 days 00:00:59.838884,tanh,87.85748272205761,auto,145,50,95.0,,,,,,,,invscaling,2.432453622488158e-05,3,lbfgs,COMPLETE
90,0.688364840178466,2024-01-28 22:30:17.016137,2024-01-28 22:31:21.599428,0 days 00:01:04.583291,tanh,88.27836421307164,auto,145,50,100.0,,,,,,,,invscaling,2.5430289705333316e-05,3,lbfgs,COMPLETE
91,0.6883950143924512,2024-01-28 22:30:19.618670,2024-01-28 22:31:28.317554,0 days 00:01:08.698884,tanh,88.20575069625525,auto,105,85,95.0,,,,,,,,invscaling,2.410159987188783e-05,3,lbfgs,COMPLETE
92,0.6883649578659273,2024-01-28 22:30:20.246674,2024-01-28 22:31:27.604557,0 days 00:01:07.357883,tanh,87.95558940384706,auto,45,50,50.0,,,,,,,,invscaling,2.2808149437768552e-05,3,lbfgs,COMPLETE
93,0.688309696800589,2024-01-28 22:30:22.905314,2024-01-28 22:31:40.767024,0 days 00:01:17.861710,tanh,87.77330288516092,auto,140,50,100.0,,,,,,,,invscaling,2.322728935242606e-05,3,lbfgs,COMPLETE
94,0.6881177023155346,2024-01-28 22:30:26.143099,2024-01-28 22:31:46.788694,0 days 00:01:20.645595,tanh,67.03349748474135,auto,105,85,95.0,,,,,,,,invscaling,2.4888411452404407e-05,3,lbfgs,COMPLETE
95,0.6881408879753472,2024-01-28 22:30:28.043101,2024-01-28 22:31:47.475698,0 days 00:01:19.432597,tanh,88.45691816199786,auto,105,50,100.0,,,,,,,,invscaling,2.3374443921487335e-05,3,lbfgs,COMPLETE
96,0.688364789885051,2024-01-28 22:30:31.727823,2024-01-28 22:31:54.997406,0 days 00:01:23.269583,tanh,88.31691168529102,auto,105,50,100.0,,,,,,,,invscaling,2.0444511399051645e-05,3,lbfgs,COMPLETE
97,0.6884279577736535,2024-01-28 22:30:34.209604,2024-01-28 22:31:58.386781,0 days 00:01:24.177177,tanh,87.61855955362891,auto,100,45,105.0,,,,,,,,invscaling,0.001215772610677436,3,lbfgs,COMPLETE
98,0.6882022473931069,2024-01-28 22:30:38.124895,2024-01-28 22:31:59.486839,0 days 00:01:21.361944,tanh,96.74913290968733,auto,105,50,105.0,,,,,,,,invscaling,0.0010253405819868888,3,lbfgs,COMPLETE
99,0.6884358309058269,2024-01-28 22:30:50.138337,2024-01-28 22:32:00.398663,0 days 00:01:10.260326,tanh,87.74615705985917,auto,105,50,50.0,,,,,,,,invscaling,0.0009083751584535933,3,lbfgs,COMPLETE
