number,value,datetime_start,datetime_complete,duration,params_C,params_degree,params_gamma,params_kernel,params_shrinking,state
0,0.49556758540005375,2024-01-28 19:45:52.474299,2024-01-28 19:45:59.136365,0 days 00:00:06.662066,888.9379462630469,12,2.5,poly,False,COMPLETE
1,0.5280736310110281,2024-01-28 19:45:52.475295,2024-01-28 19:45:59.864669,0 days 00:00:07.389374,394.3768595182769,7,1.5,poly,True,COMPLETE
2,0.5692111263382132,2024-01-28 19:45:52.477297,2024-01-28 19:46:01.106077,0 days 00:00:08.628780,445.1540908604345,12,auto,rbf,True,COMPLETE
3,0.5208254650339472,2024-01-28 19:45:52.479295,2024-01-28 19:46:08.204594,0 days 00:00:15.725299,463.95640488383464,5,1.5,rbf,False,COMPLETE
4,0.5113402554109774,2024-01-28 19:45:52.481296,2024-01-28 19:46:18.060177,0 days 00:00:25.578881,11.140881265634372,9,2.5,rbf,True,COMPLETE
5,0.5673075288684677,2024-01-28 19:45:52.482295,2024-01-28 19:46:06.292504,0 days 00:00:13.810209,758.0455862834822,3,auto,poly,True,COMPLETE
6,0.5703432913306397,2024-01-28 19:45:52.484295,2024-01-28 19:46:13.781962,0 days 00:00:21.297667,333.8498550672142,3,1.5,poly,False,COMPLETE
7,0.5529579664073366,2024-01-28 19:45:52.486295,2024-01-28 19:46:16.538193,0 days 00:00:24.051898,226.63145227026166,5,0.5,poly,False,COMPLETE
8,0.49537572547371234,2024-01-28 19:45:52.490295,2024-01-28 19:46:24.279744,0 days 00:00:31.789449,644.169826159179,12,0.5,poly,False,COMPLETE
9,0.5316976941681358,2024-01-28 19:45:52.491299,2024-01-28 19:46:22.732212,0 days 00:00:30.240913,844.6383156871707,9,auto,poly,True,COMPLETE
10,0.5915922447435373,2024-01-28 19:45:52.494297,2024-01-28 19:46:30.608154,0 days 00:00:38.113857,220.4940791215129,12,scale,rbf,False,COMPLETE
11,0.5692111263382132,2024-01-28 19:45:52.496295,2024-01-28 19:46:32.186936,0 days 00:00:39.690641,437.8944391569087,9,auto,rbf,False,COMPLETE
12,0.528161525146763,2024-01-28 19:45:52.497295,2024-01-28 19:46:28.359009,0 days 00:00:35.861714,130.97973943606308,9,scale,poly,True,COMPLETE
13,0.5383296333958464,2024-01-28 19:45:52.500299,2024-01-28 19:46:29.311296,0 days 00:00:36.810997,6.438089263234047,5,auto,poly,True,COMPLETE
14,0.575461790205755,2024-01-28 19:45:52.501298,2024-01-28 19:46:31.575761,0 days 00:00:39.074463,71.56461168959898,3,scale,poly,False,COMPLETE
15,0.5272557502711305,2024-01-28 19:45:52.502302,2024-01-28 19:46:36.166329,0 days 00:00:43.664027,442.3095172915639,3,0.5,rbf,False,COMPLETE
16,0.5380513910825603,2024-01-28 19:45:59.847675,2024-01-28 19:46:34.078932,0 days 00:00:34.231257,165.7048478797995,7,auto,poly,False,COMPLETE
17,0.49537572547371234,2024-01-28 19:46:00.363660,2024-01-28 19:46:34.957325,0 days 00:00:34.593665,26.710404200420243,12,0.5,poly,True,COMPLETE
18,0.5113402554109774,2024-01-28 19:46:02.075193,2024-01-28 19:46:40.712900,0 days 00:00:38.637707,378.1812507307698,7,2.5,rbf,False,COMPLETE
19,0.5529579664073366,2024-01-28 19:46:06.919297,2024-01-28 19:46:39.825664,0 days 00:00:32.906367,379.44005779370633,5,0.5,poly,True,COMPLETE
20,0.5113402554109774,2024-01-28 19:46:09.027230,2024-01-28 19:46:44.935369,0 days 00:00:35.908139,257.11818887652754,7,2.5,rbf,True,COMPLETE
21,0.5692111263382132,2024-01-28 19:46:14.580046,2024-01-28 19:46:48.961888,0 days 00:00:34.381842,281.9289486760154,5,auto,rbf,True,COMPLETE
22,0.5280736310110281,2024-01-28 19:46:17.331796,2024-01-28 19:46:46.398200,0 days 00:00:29.066404,950.9531059653164,7,1.5,poly,False,COMPLETE
23,0.5915922447435373,2024-01-28 19:46:18.786183,2024-01-28 19:46:51.313363,0 days 00:00:32.527180,774.6052469364173,7,scale,rbf,False,COMPLETE
24,0.49537572547371234,2024-01-28 19:46:23.262179,2024-01-28 19:46:51.939291,0 days 00:00:28.677112,436.10918566186473,12,0.5,poly,True,COMPLETE
25,0.5915922447435373,2024-01-28 19:46:25.007054,2024-01-28 19:46:55.107867,0 days 00:00:30.100813,173.32583858496133,3,scale,rbf,False,COMPLETE
26,0.5692111263382132,2024-01-28 19:46:28.836561,2024-01-28 19:47:02.515813,0 days 00:00:33.679252,329.0875058941535,3,auto,rbf,False,COMPLETE
27,0.5208254650339472,2024-01-28 19:46:29.896922,2024-01-28 19:47:00.592636,0 days 00:00:30.695714,334.4238268707932,3,1.5,rbf,False,COMPLETE
28,0.5915922447435373,2024-01-28 19:46:31.405755,2024-01-28 19:47:01.593194,0 days 00:00:30.187439,279.7186402895691,3,scale,rbf,False,COMPLETE
29,0.5915922447435373,2024-01-28 19:46:32.130949,2024-01-28 19:47:05.266379,0 days 00:00:33.135430,229.6713522108344,3,scale,rbf,False,COMPLETE
30,0.5915922447435373,2024-01-28 19:46:32.810937,2024-01-28 19:47:08.149642,0 days 00:00:35.338705,206.7136705394882,3,scale,rbf,False,COMPLETE
31,0.5915922447435373,2024-01-28 19:46:34.784678,2024-01-28 19:47:08.867642,0 days 00:00:34.082964,231.3694541591189,3,scale,rbf,False,COMPLETE
32,0.5915922447435373,2024-01-28 19:46:35.635322,2024-01-28 19:47:15.053437,0 days 00:00:39.418115,275.3410547100549,3,scale,rbf,False,COMPLETE
33,0.5915922447435373,2024-01-28 19:46:37.028701,2024-01-28 19:47:15.633087,0 days 00:00:38.604386,261.93486754112826,3,scale,rbf,False,COMPLETE
34,0.5915922447435373,2024-01-28 19:46:40.379802,2024-01-28 19:47:16.250981,0 days 00:00:35.871179,608.2625532619163,3,scale,rbf,False,COMPLETE
35,0.5915922447435373,2024-01-28 19:46:41.305911,2024-01-28 19:47:19.155878,0 days 00:00:37.849967,260.8658048310873,3,scale,rbf,False,COMPLETE
36,0.5915922447435373,2024-01-28 19:46:45.538013,2024-01-28 19:47:22.190067,0 days 00:00:36.652054,286.6936912110298,3,scale,rbf,False,COMPLETE
37,0.5915922447435373,2024-01-28 19:46:47.103874,2024-01-28 19:47:27.930601,0 days 00:00:40.826727,284.2284981477578,3,scale,rbf,False,COMPLETE
38,0.5915922447435373,2024-01-28 19:46:49.747449,2024-01-28 19:47:26.073708,0 days 00:00:36.326259,592.9914980440165,3,scale,rbf,False,COMPLETE
39,0.5915922447435373,2024-01-28 19:46:51.889281,2024-01-28 19:47:28.974696,0 days 00:00:37.085415,104.57160600087354,3,scale,rbf,False,COMPLETE
40,0.5915922447435373,2024-01-28 19:46:52.673579,2024-01-28 19:47:34.277257,0 days 00:00:41.603678,642.3655240406299,3,scale,rbf,False,COMPLETE
41,0.5915922447435373,2024-01-28 19:46:55.789956,2024-01-28 19:47:35.432896,0 days 00:00:39.642940,615.2305000786369,3,scale,rbf,False,COMPLETE
42,0.5915922447435373,2024-01-28 19:47:01.118500,2024-01-28 19:47:40.628663,0 days 00:00:39.510163,580.1692583420953,3,scale,rbf,False,COMPLETE
43,0.5915922447435373,2024-01-28 19:47:02.483816,2024-01-28 19:47:41.851673,0 days 00:00:39.367857,540.5024508873869,12,scale,rbf,False,COMPLETE
44,0.5915922447435373,2024-01-28 19:47:03.147893,2024-01-28 19:47:37.683564,0 days 00:00:34.535671,550.0242700733136,12,scale,rbf,False,COMPLETE
45,0.5915922447435373,2024-01-28 19:47:06.028517,2024-01-28 19:47:43.213853,0 days 00:00:37.185336,619.4840650377671,12,scale,rbf,False,COMPLETE
46,0.5915922447435373,2024-01-28 19:47:08.728639,2024-01-28 19:47:45.817060,0 days 00:00:37.088421,572.9947920888417,12,scale,rbf,False,COMPLETE
47,0.5915922447435373,2024-01-28 19:47:09.548030,2024-01-28 19:47:52.767437,0 days 00:00:43.219407,577.9236399102092,12,scale,rbf,False,COMPLETE
48,0.5915922447435373,2024-01-28 19:47:15.590072,2024-01-28 19:47:50.727603,0 days 00:00:35.137531,573.5501302561573,12,scale,rbf,False,COMPLETE
49,0.5915922447435373,2024-01-28 19:47:16.160975,2024-01-28 19:47:54.520010,0 days 00:00:38.359035,581.3894598409714,12,scale,rbf,False,COMPLETE
50,0.5915922447435373,2024-01-28 19:47:16.830640,2024-01-28 19:47:51.706882,0 days 00:00:34.876242,540.1562724365405,12,scale,rbf,False,COMPLETE
51,0.5915922447435373,2024-01-28 19:47:19.930957,2024-01-28 19:47:58.546450,0 days 00:00:38.615493,563.3464936857672,12,scale,rbf,False,COMPLETE
52,0.5915922447435373,2024-01-28 19:47:23.000713,2024-01-28 19:47:59.438437,0 days 00:00:36.437724,556.147195672156,12,scale,rbf,False,COMPLETE
53,0.5915922447435373,2024-01-28 19:47:26.808389,2024-01-28 19:48:04.605391,0 days 00:00:37.797002,135.07226760881878,12,scale,rbf,False,COMPLETE
54,0.5915922447435373,2024-01-28 19:47:28.874691,2024-01-28 19:48:05.332406,0 days 00:00:36.457715,519.9882999867557,12,scale,rbf,False,COMPLETE
55,0.5915922447435373,2024-01-28 19:47:29.691710,2024-01-28 19:48:06.780403,0 days 00:00:37.088693,742.907173369682,12,scale,rbf,False,COMPLETE
56,0.5915922447435373,2024-01-28 19:47:34.769903,2024-01-28 19:48:09.569958,0 days 00:00:34.800055,504.79052476670705,12,scale,rbf,False,COMPLETE
57,0.5915922447435373,2024-01-28 19:47:36.072897,2024-01-28 19:48:17.452463,0 days 00:00:41.379566,523.5682025785368,12,scale,rbf,False,COMPLETE
58,0.5915922447435373,2024-01-28 19:47:38.274660,2024-01-28 19:48:14.160366,0 days 00:00:35.885706,173.17347816187106,12,scale,rbf,False,COMPLETE
59,0.5915922447435373,2024-01-28 19:47:41.265659,2024-01-28 19:48:15.351465,0 days 00:00:34.085806,706.3512993567222,12,scale,rbf,False,COMPLETE
60,0.5113402554109774,2024-01-28 19:47:42.614229,2024-01-28 19:48:20.416914,0 days 00:00:37.802685,821.3275124394198,7,2.5,rbf,False,COMPLETE
61,0.5113402554109774,2024-01-28 19:47:44.112421,2024-01-28 19:48:23.467002,0 days 00:00:39.354581,738.3783577266918,7,2.5,rbf,False,COMPLETE
62,0.5113402554109774,2024-01-28 19:47:46.483285,2024-01-28 19:48:24.284001,0 days 00:00:37.800716,722.7312166814868,7,2.5,rbf,False,COMPLETE
63,0.5113402554109774,2024-01-28 19:47:51.186604,2024-01-28 19:48:29.463170,0 days 00:00:38.276566,733.3855457043824,7,2.5,rbf,False,COMPLETE
64,0.5113402554109774,2024-01-28 19:47:52.220885,2024-01-28 19:48:31.145731,0 days 00:00:38.924846,719.3157295771275,7,2.5,rbf,False,COMPLETE
65,0.5113402554109774,2024-01-28 19:47:53.375408,2024-01-28 19:48:33.003009,0 days 00:00:39.627601,719.7617048547245,7,2.5,rbf,False,COMPLETE
66,0.5113402554109774,2024-01-28 19:47:55.173032,2024-01-28 19:48:37.100520,0 days 00:00:41.927488,192.75460598417862,7,2.5,rbf,False,COMPLETE
67,0.5113402554109774,2024-01-28 19:47:59.070449,2024-01-28 19:48:38.958631,0 days 00:00:39.888182,183.5879981541962,7,2.5,rbf,False,COMPLETE
68,0.5113402554109774,2024-01-28 19:48:00.057452,2024-01-28 19:48:42.401189,0 days 00:00:42.343737,188.20731622896744,7,2.5,rbf,False,COMPLETE
69,0.5113402554109774,2024-01-28 19:48:05.282401,2024-01-28 19:48:46.934254,0 days 00:00:41.651853,180.97492014633585,7,2.5,rbf,False,COMPLETE
70,0.5113402554109774,2024-01-28 19:48:06.049400,2024-01-28 19:48:47.710061,0 days 00:00:41.660661,148.08203973651206,7,2.5,rbf,False,COMPLETE
71,0.5113402554109774,2024-01-28 19:48:07.538966,2024-01-28 19:48:50.482457,0 days 00:00:42.943491,197.6098509728732,7,2.5,rbf,False,COMPLETE
72,0.5208254650339472,2024-01-28 19:48:10.257960,2024-01-28 19:48:52.978064,0 days 00:00:42.720104,199.6460032842237,7,1.5,rbf,False,COMPLETE
73,0.5113402554109774,2024-01-28 19:48:14.728912,2024-01-28 19:48:56.733060,0 days 00:00:42.004148,199.6570315948745,7,2.5,rbf,True,COMPLETE
74,0.5113402554109774,2024-01-28 19:48:16.008463,2024-01-28 19:48:59.687206,0 days 00:00:43.678743,190.5751454480223,7,2.5,rbf,True,COMPLETE
75,0.5113402554109774,2024-01-28 19:48:18.100740,2024-01-28 19:49:02.134883,0 days 00:00:44.034143,194.5658753544264,7,2.5,rbf,True,COMPLETE
76,0.5208254650339472,2024-01-28 19:48:21.118911,2024-01-28 19:49:04.789074,0 days 00:00:43.670163,195.89617315125608,9,1.5,rbf,True,COMPLETE
77,0.5208254650339472,2024-01-28 19:48:24.214996,2024-01-28 19:49:08.092814,0 days 00:00:43.877818,198.65247201044903,9,1.5,rbf,True,COMPLETE
78,0.5208254650339472,2024-01-28 19:48:24.920005,2024-01-28 19:49:09.749815,0 days 00:00:44.829810,204.75348127665012,9,1.5,rbf,True,COMPLETE
79,0.5208254650339472,2024-01-28 19:48:30.067173,2024-01-28 19:49:13.953685,0 days 00:00:43.886512,209.16239838668687,9,1.5,rbf,True,COMPLETE
80,0.5187255042119518,2024-01-28 19:48:31.712363,2024-01-28 19:49:12.726461,0 days 00:00:41.014098,184.51444782431744,9,1.5,poly,True,COMPLETE
81,0.5187255042119518,2024-01-28 19:48:33.716756,2024-01-28 19:49:14.576665,0 days 00:00:40.859909,206.67145046457438,9,1.5,poly,True,COMPLETE
82,0.5187255042119518,2024-01-28 19:48:37.867522,2024-01-28 19:49:15.730220,0 days 00:00:37.862698,220.04303032072315,9,1.5,poly,True,COMPLETE
83,0.5187255042119518,2024-01-28 19:48:39.553634,2024-01-28 19:49:18.507397,0 days 00:00:38.953763,230.94534884499947,9,1.5,poly,True,COMPLETE
84,0.5187255042119518,2024-01-28 19:48:43.147838,2024-01-28 19:49:19.159136,0 days 00:00:36.011298,103.77433671177387,9,1.5,poly,True,COMPLETE
85,0.5187255042119518,2024-01-28 19:48:47.661056,2024-01-28 19:49:21.861932,0 days 00:00:34.200876,231.85809024215544,9,1.5,poly,True,COMPLETE
86,0.5703432913306397,2024-01-28 19:48:48.636302,2024-01-28 19:49:25.801959,0 days 00:00:37.165657,233.3779153527961,3,1.5,poly,True,COMPLETE
87,0.5703432913306397,2024-01-28 19:48:51.081239,2024-01-28 19:49:26.551597,0 days 00:00:35.470358,231.47988921206786,3,1.5,poly,True,COMPLETE
88,0.5684791704939414,2024-01-28 19:48:53.710056,2024-01-28 19:49:28.432607,0 days 00:00:34.722551,234.33413334285572,3,0.5,poly,True,COMPLETE
89,0.5272557502711305,2024-01-28 19:48:57.428262,2024-01-28 19:49:32.283145,0 days 00:00:34.854883,234.26940882330052,3,0.5,rbf,True,COMPLETE
90,0.5684791704939414,2024-01-28 19:49:00.224879,2024-01-28 19:49:32.854683,0 days 00:00:32.629804,232.80156304337746,3,0.5,poly,False,COMPLETE
91,0.5684791704939414,2024-01-28 19:49:02.813890,2024-01-28 19:49:34.116460,0 days 00:00:31.302570,55.10928981451681,3,0.5,poly,False,COMPLETE
92,0.5684791704939414,2024-01-28 19:49:05.550080,2024-01-28 19:49:39.189416,0 days 00:00:33.639336,52.77052035060427,3,0.5,poly,False,COMPLETE
93,0.5684791704939414,2024-01-28 19:49:08.739817,2024-01-28 19:49:39.725021,0 days 00:00:30.985204,84.15269552567491,3,0.5,poly,False,COMPLETE
94,0.5684791704939414,2024-01-28 19:49:10.571353,2024-01-28 19:49:40.633806,0 days 00:00:30.062453,88.55660714227793,3,0.5,poly,False,COMPLETE
95,0.5684791704939414,2024-01-28 19:49:13.320011,2024-01-28 19:49:45.983695,0 days 00:00:32.663684,90.09155504860419,3,0.5,poly,False,COMPLETE
96,0.5623942237690516,2024-01-28 19:49:14.515684,2024-01-28 19:49:46.948321,0 days 00:00:32.432637,240.86120054568653,3,scale,poly,False,COMPLETE
97,0.5915922447435373,2024-01-28 19:49:15.173669,2024-01-28 19:49:48.905321,0 days 00:00:33.731652,242.53393928558012,3,scale,rbf,False,COMPLETE
98,0.5915922447435373,2024-01-28 19:49:16.545213,2024-01-28 19:49:50.142405,0 days 00:00:33.597192,317.91705855639395,3,scale,rbf,False,COMPLETE
99,0.5915922447435373,2024-01-28 19:49:19.066133,2024-01-28 19:49:50.250403,0 days 00:00:31.184270,323.1649205119209,3,scale,rbf,False,COMPLETE
